{
  "$schema": "https://json-schema.org/draft/2020-12/schema",
  "$id": "operator-dsl-loop/input.schema.json",
  "title": "operator-dsl-loop input",
  "type": "object",
  "required": [
    "runId",
    "workflowVersion",
    "goal",
    "referencePath",
    "targetArtifact",
    "targetBackend",
    "sessionMode",
    "performanceTarget"
  ],
  "properties": {
    "runId": {
      "type": "string",
      "minLength": 1
    },
    "workflowVersion": {
      "type": "string",
      "minLength": 1
    },
    "goal": {
      "type": "string",
      "minLength": 1
    },
    "referencePath": {
      "type": "string",
      "minLength": 1
    },
    "targetArtifact": {
      "type": "string",
      "minLength": 1
    },
    "targetBackend": {
      "type": "string",
      "minLength": 1
    },
    "sessionMode": {
      "type": "string",
      "enum": [
        "persistent"
      ]
    },
    "performanceTarget": {
      "type": "object",
      "required": [
        "minSpeedupVsReference"
      ],
      "properties": {
        "minSpeedupVsReference": {
          "type": "number"
        }
      },
      "additionalProperties": false
    }
  },
  "additionalProperties": false
}
