{
  "runId": "layer-norm-operator-dsl",
  "workflowVersion": "2026-07-07",
  "goal": "Implement a layer_norm DSL operator from a PyTorch reference",
  "referencePath": "reference/layer_norm.py",
  "targetArtifact": "generated/operator.dsl",
  "targetBackend": "operator-dsl",
  "sessionMode": "persistent",
  "performanceTarget": {
    "minSpeedupVsReference": 1.15
  }
}
